Sheet: sheet1
A1: 序号 | B1: 公司 | C1: 课题类型 | D1: 部门 | E1: 课题名称 | F1: 课题简称 | G1: 客户定位 | H1: 承担团队 | I1: 项目经理 | J1: A导师 | K1: B导师 | L1: C导师 | M1: 项目立项信息 | U1: 破题及内部结项情况 | AA1: 项目效率及质量实时监控 | AZ1: 结项评价 | DZ1: 第一次周验收 | FO1: 第二次周验收 | HD1: 第三次周验收 | IS1: 第四次周验收 | KH1: 第五次周验收 | LW1: 第六次周验收 | NL1: 第七次周验收 | PA1: 第八次周验收 | QP1: 第九次周验收 | SE1: 第十次周验收 | TT1: 第十一次周验收 | VI1: 第十二次周验收 | WX1: 第十三次周验收 | YM1: 第十四次周验收 | AAB1: 第十五次周验收
M2: 开始日期 | N2: 结题日期 | O2: 额定标准工时（天） | P2: 额定K值 | Q2: 一阶段标准工时(天) | R2: 二阶段 标准工 时(天) | S2: 三阶段标准工时(天) | T2: 四阶段标准工时(天) | U2: 是否破题 | V2: 破题质量分 | W2: 破题时间 | X2: 是否内部结项 | Y2: 内部结项质量分 | Z2: 内部结项时间 | AA2: 项目当前总体进度 | AB2: 项目结项质量分 | AC2: 项目当前总K值 | AD2: 项目当前总用时 | AE2: 项目当前总效率 | AF2: A导师 | AG2: 当前合计用时(小时) | AH2: 当前A导师总K值 | AI2: A导师效率 | AJ2: 项目 经理 | AK2: 当前合计用时(小时) | AL2: 当前项目经理总K值 | AM2: 项目经理效率 | AN2: 项目成员1 | AO2: 当前合计用时(小时) | AP2: 当前项目成员1总K值 | AQ2: 项目成员1效率 | AR2: 项目成员2 | AS2: 当前合计用时(小时) | AT2: 项目项目成员2总K值 | AU2: 项目成员2效率 | AV2: 项目成员3 | AW2: 当前合计用时(小时) | AX2: 当前项目成员3总K值 | AY2: 项目成员3效率 | AZ2: 第一次质量评价 | BM2: 第二次质量评价 | BZ2: 第三次质量评价 | CM2: 第四次质量评价 | CZ2: 第五次质量评价 | DM2: 项目完结质量评价 | DZ2: 验收时间 | EA2: 各阶段完成情况 | FG2: 总体K值 | FH2: 导师K值 | FI2: 项目经理K值 | FJ2: 项目成员1K值 | FK2: 项目成员2K值 | FL2: 项目成员3K值 | FM2: 质量得分 | FN2: B导师 | FO2: 验收时间 | FP2: 各阶段完成情况 | GV2: 总体K值 | GW2: 导师K值 | GX2: 项目经理K值 | GY2: 项目成员K值 | GZ2: 项目成员2K值 | HA2: 项目成员3K值 | HB2: 质量得分 | HC2: B导师 | HD2: 验收时间 | HE2: 各阶段完成情况 | IK2: 总体K值 | IL2: 导师K值 | IM2: 项目经理K值 | IN2: 项目成员K值 | IO2: 项目成员2K值 | IP2: 项目成员3K值 | IQ2: 质量得分 | IR2: B导师 | IS2: 验收时间 | IT2: 各阶段完成情况 | JZ2: 总体K值 | KA2: 导师K值 | KB2: 项目经理K值 | KC2: 项目成员K值 | KD2: 项目成员2K值 | KE2: 项目成员3K值 | KF2: 质量得分 | KG2: B导师 | KH2: 验收时间 | KI2: 各阶段完成情况 | LO2: 总体K值 | LP2: 导师K值 | LQ2: 项目经理K值 | LR2: 项目成员K值 | LS2: 项目成员2K值 | LT2: 项目成员3K值 | LU2: 质量得分 | LV2: B导师 | LW2: 验收时间 | LX2: 各阶段完成情况 | ND2: 总体K值 | NE2: 导师K值 | NF2: 项目经理K值 | NG2: 项目成员K值 | NH2: 项目成员2K值 | NI2: 项目成员3K值 | NJ2: 质量得分 | NK2: B导师 | NL2: 验收时间 | NM2: 各阶段完成情况 | OS2: 总体K值 | OT2: 导师K值 | OU2: 项目经理K值 | OV2: 项目成员K值 | OW2: 项目成员2K值 | OX2: 项目成员3K值 | OY2: 质量得分 | OZ2: B导师 | PA2: 验收时间 | PB2: 各阶段完成情况 | QH2: 总体K值 | QI2: 导师K值 | QJ2: 项目经理K值 | QK2: 项目成员K值 | QL2: 项目成员2K值 | QM2: 项目成员3K值 | QN2: 质量得分 | QO2: B导师 | QP2: 验收时间 | QQ2: 各阶段完成情况 | RW2: 总体K值 | RX2: 导师K值 | RY2: 项目经理K值 | RZ2: 项目成员K值 | SA2: 项目成员2K值 | SB2: 项目成员3K值 | SC2: 质量得分 | SD2: B导师 | SE2: 验收时间 | SF2: 各阶段完成情况 | TL2: 总体K值 | TM2: 导师K值 | TN2: 项目经理K值 | TO2: 项目成员K值 | TP2: 项目成员2K值 | TQ2: 项目成员3K值 | TR2: 质量得分 | TS2: B导师 | TT2: 验收时间 | TU2: 各阶段完成情况 | VA2: 总体K值 | VB2: 导师K值 | VC2: 项目经理K值 | VD2: 项目成员K值 | VE2: 项目成员2K值 | VF2: 项目成员3K值 | VG2: 质量得分 | VH2: B导师 | VI2: 验收时间 | VJ2: 各阶段完成情况 | WP2: 总体K值 | WQ2: 导师K值 | WR2: 项目经理K值 | WS2: 项目成员K值 | WT2: 项目成员2K值 | WU2: 项目成员3K值 | WV2: 质量得分 | WW2: B导师 | WX2: 验收时间 | WY2: 各阶段完成情况 | YE2: 总体K值 | YF2: 导师K值 | YG2: 项目经理K值 | YH2: 项目成员K值 | YI2: 项目成员2K值 | YJ2: 项目成员3K值 | YK2: 质量得分 | YL2: B导师 | YM2: 验收时间 | YN2: 各阶段完成情况 | ZT2: 总体K值 | ZU2: 导师K值 | ZV2: 项目经理K值 | ZW2: 项目成员K值 | ZX2: 项目成员2K值 | ZY2: 项目成员3K值 | ZZ2: 质量得分 | AAA2: B导师 | AAB2: 验收时间 | AAC2: 各阶段完成情况 | ABI2: 总体K值 | ABJ2: 导师K值 | ABK2: 项目经理K值 | ABL2: 项目成员K值 | ABM2: 项目成员2K值 | ABN2: 项目成员3K值 | ABO2: 质量得分 | ABP2: B导师
AZ3: 验收日期 | BA3: 质量分 | BB3: 导师占比 | BC3: 项目经理占比 | BD3: 项目成员1占比 | BE3: 项目成员2占比 | BF3: 项目成员3占比 | BG3: 总体K值 | BH3: 导师K值 | BI3: 项目经理K值 | BJ3: 项目成员1K值 | BK3: 项目成员2K值 | BL3: 项目成员3K值 | BM3: 验收日期 | BN3: 质量分 | BO3: 导师占比 | BP3: 项目经理占比 | BQ3: 项目成员1占比 | BR3: 项目成员2占比 | BS3: 项目成员3占比 | BT3: 总体K值 | BU3: 导师K值 | BV3: 项目经理K值 | BW3: 项目成员1K值 | BX3: 项目成员2K值 | BY3: 项目成员3K值 | BZ3: 验收日期 | CA3: 质量分 | CB3: 导师占比 | CC3: 项目经理占比 | CD3: 项目成员1占比 | CE3: 项目成员2占比 | CF3: 项目成员3占比 | CG3: 总体K值 | CH3: 导师K值 | CI3: 项目经理K值 | CJ3: 项目成员1K值 | CK3: 项目成员2K值 | CL3: 项目成员3K值 | CM3: 验收日期 | CN3: 质量分 | CO3: 导师占比 | CP3: 项目经理占比 | CQ3: 项目成员1占比 | CR3: 项目成员2占比 | CS3: 项目成员3占比 | CT3: 总体K值 | CU3: 导师K值 | CV3: 项目经理K值 | CW3: 项目成员1K值 | CX3: 项目成员2K值 | CY3: 项目成员3K值 | CZ3: 验收日期 | DA3: 质量分 | DB3: 导师占比 | DC3: 项目经理占比 | DD3: 项目成员1占比 | DE3: 项目成员2占比 | DF3: 项目成员3占比 | DG3: 总体K值 | DH3: 导师K值 | DI3: 项目经理K值 | DJ3: 项目成员1K值 | DK3: 项目成员2K值 | DL3: 项目成员3K值 | DM3: 验收日期 | DN3: 质量分 | DO3: 导师占比 | DP3: 项目经理占比 | DQ3: 项目成员1占比 | DR3: 项目成员2占比 | DS3: 项目成员3占比 | DT3: 总体K值 | DU3: 导师K值 | DV3: 项目经理K值 | DW3: 项目成员1K值 | DX3: 项目成员2K值 | DY3: 项目成员3K值 | EA3: 定义/模型 | EI3: 测量分析/半初稿 | EQ3: 改进控制/初稿 | EY3: 定稿 | FP3: 定义/模型 | FX3: 测量分析/半初稿 | GF3: 改进控制/初稿 | GN3: 定稿 | HE3: 定义/模型 | HM3: 测量分析/半初稿 | HU3: 改进控制/初稿 | IC3: 定稿 | IT3: 定义/模型 | JB3: 测量分析/半初稿 | JJ3: 改进控制/初稿 | JR3: 定稿 | KI3: 定义/模型 | KQ3: 测量分析/半初稿 | KY3: 改进控制/初稿 | LG3: 定稿 | LX3: 定义/模型 | MF3: 测量分析/半初稿 | MN3: 改进控制/初稿 | MV3: 定稿 | NM3: 定义/模型 | NU3: 测量分析/半初稿 | OC3: 改进控制/初稿 | OK3: 定稿 | PB3: 定义/模型 | PJ3: 测量分析/半初稿 | PR3: 改进控制/初稿 | PZ3: 定稿 | QQ3: 定义/模型 | QY3: 测量分析/半初稿 | RG3: 改进控制/初稿 | RO3: 定稿 | SF3: 定义/模型 | SN3: 测量分析/半初稿 | SV3: 改进控制/初稿 | TD3: 定稿 | TU3: 定义/模型 | UC3: 测量分析/半初稿 | UK3: 改进控制/初稿 | US3: 定稿 | VJ3: 定义/模型 | VR3: 测量分析/半初稿 | VZ3: 改进控制/初稿 | WH3: 定稿 | WY3: 定义/模型 | XG3: 测量分析/半初稿 | XO3: 改进控制/初稿 | XW3: 定稿 | YN3: 定义/模型 | YV3: 测量分析/半初稿 | ZD3: 改进控制/初稿 | ZL3: 定稿 | AAC3: 定义/模型 | AAK3: 测量分析/半初稿 | AAS3: 改进控制/初稿 | ABA3: 定稿
EA4: 此阶段质量 | EB4: 此阶段进度 | EC4: 完成比例 | ED4: 导师占比 | EE4: 项目经理占比 | EF4: 项目成员1占比 | EG4: 项目成员2占比 | EH4: 项目成员3占比 | EI4: 此阶段质量 | EJ4: 此阶段进度 | EK4: 完成比例 | EL4: 导师占比 | EM4: 项目经理占比 | EN4: 项目成员1占比 | EO4: 项目成员2占比 | EP4: 项目成员3占比 | EQ4: 此阶段质量 | ER4: 此阶段进度 | ES4: 完成比例 | ET4: 导师占比 | EU4: 项目经理占比 | EV4: 项目成员1占比 | EW4: 项目成员2占比 | EX4: 项目成员3占比 | EY4: 此阶段质量 | EZ4: 此阶段进度 | FA4: 完成比例 | FB4: 导师占比 | FC4: 项目经理占比 | FD4: 项目成员1占比 | FE4: 项目成员2占比 | FF4: 项目成员3占比 | FP4: 此阶段质量 | FQ4: 此阶段进度 | FR4: 完成比例 | FS4: 导师占比 | FT4: 项目经理占比 | FU4: 项目成员占比 | FV4: 项目成员2占比 | FW4: 项目成员3占比 | FX4: 此阶段质量 | FY4: 此阶段进度 | FZ4: 完成比例 | GA4: 导师占比 | GB4: 项目经理占比 | GC4: 项目成员占比 | GD4: 项目成员2占比 | GE4: 项目成员3占比 | GF4: 此阶段质量 | GG4: 此阶段进度 | GH4: 完成比例 | GI4: 导师占比 | GJ4: 项目经理占比 | GK4: 项目成员占比 | GL4: 项目成员2占比 | GM4: 项目成员3占比 | GN4: 此阶段质量 | GO4: 此阶段进度 | GP4: 完成比例 | GQ4: 导师占比 | GR4: 项目经理占比 | GS4: 项目成员占比 | GT4: 项目成员2占比 | GU4: 项目成员3占比 | HE4: 此阶段质量 | HF4: 此阶段进度 | HG4: 完成比例 | HH4: 导师占比 | HI4: 项目经理占比 | HJ4: 项目成员占比 | HK4: 项目成员2占比 | HL4: 项目成员3占比 | HM4: 此阶段质量 | HN4: 此阶段进度 | HO4: 完成比例 | HP4: 导师占比 | HQ4: 项目经理占比 | HR4: 项目成员占比 | HS4: 项目成员2占比 | HT4: 项目成员3占比 | HU4: 此阶段质量 | HV4: 此阶段进度 | HW4: 完成比例 | HX4: 导师占比 | HY4: 项目经理占比 | HZ4: 项目成员占比 | IA4: 项目成员2占比 | IB4: 项目成员3占比 | IC4: 此阶段质量 | ID4: 此阶段进度 | IE4: 完成比例 | IF4: 导师占比 | IG4: 项目经理占比 | IH4: 项目成员占比 | II4: 项目成员2占比 | IJ4: 项目成员3占比 | IT4: 此阶段质量 | IU4: 此阶段进度 | IV4: 完成比例 | IW4: 导师占比 | IX4: 项目经理占比 | IY4: 项目成员占比 | IZ4: 项目成员2占比 | JA4: 项目成员3占比 | JB4: 此阶段质量 | JC4: 此阶段进度 | JD4: 完成比例 | JE4: 导师占比 | JF4: 项目经理占比 | JG4: 项目成员占比 | JH4: 项目成员2占比 | JI4: 项目成员3占比 | JJ4: 此阶段质量 | JK4: 此阶段进度 | JL4: 完成比例 | JM4: 导师占比 | JN4: 项目经理占比 | JO4: 项目成员占比 | JP4: 项目成员2占比 | JQ4: 项目成员3占比 | JR4: 此阶段质量 | JS4: 此阶段进度 | JT4: 完成比例 | JU4: 导师占比 | JV4: 项目经理占比 | JW4: 项目成员占比 | JX4: 项目成员2占比 | JY4: 项目成员3占比 | KI4: 此阶段质量 | KJ4: 此阶段进度 | KK4: 完成比例 | KL4: 导师占比 | KM4: 项目经理占比 | KN4: 项目成员占比 | KO4: 项目成员2占比 | KP4: 项目成员3占比 | KQ4: 此阶段质量 | KR4: 此阶段进度 | KS4: 完成比例 | KT4: 导师占比 | KU4: 项目经理占比 | KV4: 项目成员占比 | KW4: 项目成员2占比 | KX4: 项目成员3占比 | KY4: 此阶段质量 | KZ4: 此阶段进度 | LA4: 完成比例 | LB4: 导师占比 | LC4: 项目经理占比 | LD4: 项目成员占比 | LE4: 项目成员2占比 | LF4: 项目成员3占比 | LG4: 此阶段质量 | LH4: 此阶段进度 | LI4: 完成比例 | LJ4: 导师占比 | LK4: 项目经理占比 | LL4: 项目成员占比 | LM4: 项目成员2占比 | LN4: 项目成员3占比 | LX4: 此阶段质量 | LY4: 此阶段进度 | LZ4: 完成比例 | MA4: 导师占比 | MB4: 项目经理占比 | MC4: 项目成员占比 | MD4: 项目成员2占比 | ME4: 项目成员3占比 | MF4: 此阶段质量 | MG4: 此阶段进度 | MH4: 完成比例 | MI4: 导师占比 | MJ4: 项目经理占比 | MK4: 项目成员占比 | ML4: 项目成员2占比 | MM4: 项目成员3占比 | MN4: 此阶段质量 | MO4: 此阶段进度 | MP4: 完成比例 | MQ4: 导师占比 | MR4: 项目经理占比 | MS4: 项目成员占比 | MT4: 项目成员2占比 | MU4: 项目成员3占比 | MV4: 此阶段质量 | MW4: 此阶段进度 | MX4: 完成比例 | MY4: 导师占比 | MZ4: 项目经理占比 | NA4: 项目成员占比 | NB4: 项目成员2占比 | NC4: 项目成员3占比 | NM4: 此阶段质量 | NN4: 此阶段进度 | NO4: 完成比例 | NP4: 导师占比 | NQ4: 项目经理占比 | NR4: 项目成员占比 | NS4: 项目成员2占比 | NT4: 项目成员3占比 | NU4: 此阶段质量 | NV4: 此阶段进度 | NW4: 完成比例 | NX4: 导师占比 | NY4: 项目经理占比 | NZ4: 项目成员占比 | OA4: 项目成员2占比 | OB4: 项目成员3占比 | OC4: 此阶段质量 | OD4: 此阶段进度 | OE4: 完成比例 | OF4: 导师占比 | OG4: 项目经理占比 | OH4: 项目成员占比 | OI4: 项目成员2占比 | OJ4: 项目成员3占比 | OK4: 此阶段质量 | OL4: 此阶段进度 | OM4: 完成比例 | ON4: 导师占比 | OO4: 项目经理占比 | OP4: 项目成员占比 | OQ4: 项目成员2占比 | OR4: 项目成员3占比 | PB4: 此阶段质量 | PC4: 此阶段进度 | PD4: 完成比例 | PE4: 导师占比 | PF4: 项目经理占比 | PG4: 项目成员占比 | PH4: 项目成员2占比 | PI4: 项目成员3占比 | PJ4: 此阶段质量 | PK4: 此阶段进度 | PL4: 完成比例 | PM4: 导师占比 | PN4: 项目经理占比 | PO4: 项目成员占比 | PP4: 项目成员2占比 | PQ4: 项目成员3占比 | PR4: 此阶段质量 | PS4: 此阶段进度 | PT4: 完成比例 | PU4: 导师占比 | PV4: 项目经理占比 | PW4: 项目成员占比 | PX4: 项目成员2占比 | PY4: 项目成员3占比 | PZ4: 此阶段质量 | QA4: 此阶段进度 | QB4: 完成比例 | QC4: 导师占比 | QD4: 项目经理占比 | QE4: 项目成员占比 | QF4: 项目成员2占比 | QG4: 项目成员3占比 | QQ4: 此阶段质量 | QR4: 此阶段进度 | QS4: 完成比例 | QT4: 导师占比 | QU4: 项目经理占比 | QV4: 项目成员占比 | QW4: 项目成员2占比 | QX4: 项目成员3占比 | QY4: 此阶段质量 | QZ4: 此阶段进度 | RA4: 完成比例 | RB4: 导师占比 | RC4: 项目经理占比 | RD4: 项目成员占比 | RE4: 项目成员2占比 | RF4: 项目成员3占比 | RG4: 此阶段质量 | RH4: 此阶段进度 | RI4: 完成比例 | RJ4: 导师占比 | RK4: 项目经理占比 | RL4: 项目成员占比 | RM4: 项目成员2占比 | RN4: 项目成员3占比 | RO4: 此阶段质量 | RP4: 此阶段进度 | RQ4: 完成比例 | RR4: 导师占比 | RS4: 项目经理占比 | RT4: 项目成员占比 | RU4: 项目成员2占比 | RV4: 项目成员3占比 | SF4: 此阶段质量 | SG4: 此阶段进度 | SH4: 完成比例 | SI4: 导师占比 | SJ4: 项目经理占比 | SK4: 项目成员占比 | SL4: 项目成员2占比 | SM4: 项目成员3占比 | SN4: 此阶段质量 | SO4: 此阶段进度 | SP4: 完成比例 | SQ4: 导师占比 | SR4: 项目经理占比 | SS4: 项目成员占比 | ST4: 项目成员2占比 | SU4: 项目成员3占比 | SV4: 此阶段质量 | SW4: 此阶段进度 | SX4: 完成比例 | SY4: 导师占比 | SZ4: 项目经理占比 | TA4: 项目成员占比 | TB4: 项目成员2占比 | TC4: 项目成员3占比 | TD4: 此阶段质量 | TE4: 此阶段进度 | TF4: 完成比例 | TG4: 导师占比 | TH4: 项目经理占比 | TI4: 项目成员占比 | TJ4: 项目成员2占比 | TK4: 项目成员3占比 | TU4: 此阶段质量 | TV4: 此阶段进度 | TW4: 完成比例 | TX4: 导师占比 | TY4: 项目经理占比 | TZ4: 项目成员占比 | UA4: 项目成员2占比 | UB4: 项目成员3占比 | UC4: 此阶段质量 | UD4: 此阶段进度 | UE4: 完成比例 | UF4: 导师占比 | UG4: 项目经理占比 | UH4: 项目成员占比 | UI4: 项目成员2占比 | UJ4: 项目成员3占比 | UK4: 此阶段质量 | UL4: 此阶段进度 | UM4: 完成比例 | UN4: 导师占比 | UO4: 项目经理占比 | UP4: 项目成员占比 | UQ4: 项目成员2占比 | UR4: 项目成员3占比 | US4: 此阶段质量 | UT4: 此阶段进度 | UU4: 完成比例 | UV4: 导师占比 | UW4: 项目经理占比 | UX4: 项目成员占比 | UY4: 项目成员2占比 | UZ4: 项目成员3占比 | VJ4: 此阶段质量 | VK4: 此阶段进度 | VL4: 完成比例 | VM4: 导师占比 | VN4: 项目经理占比 | VO4: 项目成员占比 | VP4: 项目成员2占比 | VQ4: 项目成员3占比 | VR4: 此阶段质量 | VS4: 此阶段进度 | VT4: 完成比例 | VU4: 导师占比 | VV4: 项目经理占比 | VW4: 项目成员占比 | VX4: 项目成员2占比 | VY4: 项目成员3占比 | VZ4: 此阶段质量 | WA4: 此阶段进度 | WB4: 完成比例 | WC4: 导师占比 | WD4: 项目经理占比 | WE4: 项目成员占比 | WF4: 项目成员2占比 | WG4: 项目成员3占比 | WH4: 此阶段质量 | WI4: 此阶段进度 | WJ4: 完成比例 | WK4: 导师占比 | WL4: 项目经理占比 | WM4: 项目成员占比 | WN4: 项目成员2占比 | WO4: 项目成员3占比 | WY4: 此阶段质量 | WZ4: 此阶段进度 | XA4: 完成比例 | XB4: 导师占比 | XC4: 项目经理占比 | XD4: 项目成员占比 | XE4: 项目成员2占比 | XF4: 项目成员3占比 | XG4: 此阶段质量 | XH4: 此阶段进度 | XI4: 完成比例 | XJ4: 导师占比 | XK4: 项目经理占比 | XL4: 项目成员占比 | XM4: 项目成员2占比 | XN4: 项目成员3占比 | XO4: 此阶段质量 | XP4: 此阶段进度 | XQ4: 完成比例 | XR4: 导师占比 | XS4: 项目经理占比 | XT4: 项目成员占比 | XU4: 项目成员2占比 | XV4: 项目成员3占比 | XW4: 此阶段质量 | XX4: 此阶段进度 | XY4: 完成比例 | XZ4: 导师占比 | YA4: 项目经理占比 | YB4: 项目成员占比 | YC4: 项目成员2占比 | YD4: 项目成员3占比 | YN4: 此阶段质量 | YO4: 此阶段进度 | YP4: 完成比例 | YQ4: 导师占比 | YR4: 项目经理占比 | YS4: 项目成员占比 | YT4: 项目成员2占比 | YU4: 项目成员3占比 | YV4: 此阶段质量 | YW4: 此阶段进度 | YX4: 完成比例 | YY4: 导师占比 | YZ4: 项目经理占比 | ZA4: 项目成员占比 | ZB4: 项目成员2占比 | ZC4: 项目成员3占比 | ZD4: 此阶段质量 | ZE4: 此阶段进度 | ZF4: 完成比例 | ZG4: 导师占比 | ZH4: 项目经理占比 | ZI4: 项目成员占比 | ZJ4: 项目成员2占比 | ZK4: 项目成员3占比 | ZL4: 此阶段质量 | ZM4: 此阶段进度 | ZN4: 完成比例 | ZO4: 导师占比 | ZP4: 项目经理占比 | ZQ4: 项目成员占比 | ZR4: 项目成员2占比 | ZS4: 项目成员3占比 | AAC4: 此阶段质量 | AAD4: 此阶段进度 | AAE4: 完成比例 | AAF4: 导师占比 | AAG4: 项目经理占比 | AAH4: 项目成员占比 | AAI4: 项目成员2占比 | AAJ4: 项目成员3占比 | AAK4: 此阶段质量 | AAL4: 此阶段进度 | AAM4: 完成比例 | AAN4: 导师占比 | AAO4: 项目经理占比 | AAP4: 项目成员占比 | AAQ4: 项目成员2占比 | AAR4: 项目成员3占比 | AAS4: 此阶段质量 | AAT4: 此阶段进度 | AAU4: 完成比例 | AAV4: 导师占比 | AAW4: 项目经理占比 | AAX4: 项目成员占比 | AAY4: 项目成员2占比 | AAZ4: 项目成员3占比 | ABA4: 此阶段质量 | ABB4: 此阶段进度 | ABC4: 完成比例 | ABD4: 导师占比 | ABE4: 项目经理占比 | ABF4: 项目成员占比 | ABG4: 项目成员2占比 | ABH4: 项目成员3占比
A5: ${p_index + 1} | B5: ${p.companyName} | C5: ${p.projectTypeName} | D5: ${p.customDepartmentName} | E5: ${p.projectName} | F5: ${p.projectShortName} | G5: ${p.location} | H5: ${p.departmentName} | I5: ${p.projectManagerName} | J5: ${p.ATeacherName} | K5: ${p.BTeacherName} | L5: ${p.CTeacherName} | M5: ${(p.startTime?string("yyyy-MM-dd"))!"--"} | N5: ${(p.finishTime?string("yyyy-MM-dd"))!"--"} | O5: ${p.initWorkload} | P5: ${p.initK?default("0")} | Q5: ${s.sectionDays} | R5: 否 | S5: 是 | T5: ${p.poScore?default("0")} | U5: ${(p.poTime?string("yyyy-MM-dd"))!"--"} | V5: 否 | W5: 是 | X5: ${p.internalProjectScore?default("0")} | Y5: ${(p.internalProjectDate?string("yyyy-MM-dd"))!"--"} | Z5: ${p.scheduleProject}% | AA5: ${p.qualityScore} | AB5: ${p.totalK?default(0)} | AC5: ${p.totalH?default(0)} | AD5: ${p.totalEfficiency?default(0)}% | AE5: ${p.AExportProjectControl.userName?default("-")} | AF5: ${p.AExportProjectControl.curreTotalH?default("0")} | AG5: ${p.AExportProjectControl.curreTotalK?default("0")} | AH5: ${p.AExportProjectControl.efficiency?default("0")}% | AI5: ${p.PMExportProjectControl.userName?default("-")} | AJ5: ${p.PMExportProjectControl.curreTotalH?default("0")} | AK5: ${p.PMExportProjectControl.curreTotalK?default("0")} | AL5: ${p.PMExportProjectControl.efficiency?default("0")}% | AM5: A | AN5: 12 | AO5: 2.2999999999999998 | AP5: 0.28999999999999998 | AQ5: B | AR5: 2 | AS5: 3 | AT5: 4 | AU5: C | AV5: 2 | AW5: 2.5 | AX5: 3.2000000000000001E-2 | AY5: 42840 | AZ5: 80 | BA5: 0.5 | BB5: 0.5 | BC5: 23 | BD5: 23 | BE5: 23 | BF5: =RC[-6]/100*RC[-43] -> 1.36 | BG5: =RC[-1]*RC[-6] -> 0.68 | BH5: =RC[-6]*RC[-2] -> 0.68 | BI5: 34 | BJ5: 34 | BK5: 34 | BL5: 42840 | BM5: 80 | BN5: 0.5 | BO5: 0.5 | BP5: 23 | BQ5: 23 | BR5: 23 | BS5: =RC[-6]/100*RC[-43] -> 1.0880000000000001 | BT5: =RC[-1]*RC[-6] -> 0.54400000000000004 | BU5: =RC[-6]*RC[-2] -> 0.54400000000000004 | BV5: 34 | BW5: 34 | BX5: 34 | BY5: 42840 | BZ5: 80 | CA5: 0.5 | CB5: 0.5 | CC5: 23 | CD5: 23 | CE5: 23 | CF5: =RC[-6]/100*RC[-43] -> 1.8399999999999999 | CG5: =RC[-1]*RC[-6] -> 0.91999999999999993 | CH5: =RC[-6]*RC[-2] -> 0.91999999999999993 | CI5: 34 | CJ5: 34 | CK5: 34 | CL5: 42840 | CM5: 80 | CN5: 0.5 | CO5: 0.5 | CP5: 23 | CQ5: 23 | CR5: 23 | CS5: =RC[-6]/100*RC[-43] -> 0.4 | CT5: =RC[-1]*RC[-6] -> 0.2 | CU5: =RC[-6]*RC[-2] -> 0.2 | CV5: 34 | CW5: 34 | CX5: 34 | CY5: 42840 | CZ5: 80 | DA5: 0.5 | DB5: 0.5 | DC5: 23 | DD5: 23 | DE5: 23 | DF5: =RC[-6]/100*RC[-43] -> 0.4 | DG5: =RC[-1]*RC[-6] -> 0.2 | DH5: =RC[-6]*RC[-2] -> 0.2 | DI5: 34 | DJ5: 34 | DK5: 34 | DL5: 43101 | DM5: 100 | DN5: 0.3 | DO5: 0.3 | DP5: 66 | DQ5: 66 | DR5: 66 | DS5: 108 | DT5: 108 | DU5: 108 | DV5: 55 | DW5: 55 | DX5: 55 | DY5: 42847 | DZ5: 0.8 | EA5: 0.8 | EB5: 0.64 | EC5: 0.1 | ED5: 0.9 | EE5: 0 | EJ5: 0 | EM5: 1 | ER5: 0 | EU5: 1 | EZ5: 0 | FC5: 1 | FF5: 0.24177777777777801 | FG5: 2.4177777777777801E-2 | FH5: 0.21759999999999999 | FI5: 0 | FJ5: 0 | FK5: 0 | FL5: 100 | FN5: 2018-01-01 | FO5: 11 | FP5: 0.11 | FQ5: 0.11 | FR5: 0.11 | FS5: 0.11 | FT5: 0.11 | FU5: 0.11 | FV5: 0.11 | FW5: 0.11 | FX5: 0.11 | FY5: 0.11 | FZ5: 0.11 | GA5: 0.11 | GB5: 0.11 | GC5: 0.11 | GD5: 0.11 | GE5: 0.11 | GF5: 0.11 | GG5: 0.11 | GH5: 0.11 | GI5: 0.11 | GJ5: 0.11 | GK5: 0.11 | GL5: 0.11 | GM5: 0.11 | GN5: 0.11 | GO5: 0.11 | GP5: 0.11 | GQ5: 0.11 | GR5: 0.11 | GS5: 0.11 | GT5: 0.11 | GU5: 0.22 | GV5: 0.22 | GW5: 0.22 | GX5: 0.22 | GY5: 0.22 | GZ5: 0.22 | HA5: 0.22 | HB5: 0.22